{
  "section_id": "A_005",
  "canvas": { "width": 860, "height": 609 },
  "background": {
    "type": "solid",
    "base_color": "#e9e8e4",
    "gradient_css": "linear-gradient(180deg, #ecebe7 0%, #e8e7e2 100%)",
    "notes": "light warm gray background"
  },
  "text_blocks": [
    {
      "id": "headline_1",
      "kind": "headline",
      "text": "CHECK POINT",
      "font_family_guess": "Pretendard or similar bold sans",
      "font_family_css": "'Pretendard', 'Noto Sans KR', 'Malgun Gothic', sans-serif",
      "font_style_notes": "large centered english headline",
      "x": 300,
      "y": 60,
      "w": 260,
      "h": 46,
      "font_size": 34,
      "font_weight": 700,
      "line_height": 1.0,
      "letter_spacing": -0.8,
      "align": "center",
      "color": "#1e232d",
      "background_color": "transparent",
      "border_radius": 0,
      "padding_css": "0",
      "estimated_line_count": 1,
      "estimated_char_count": 11,
      "is_optional": false
    },
    {
      "id": "divider_1",
      "kind": "caption",
      "text": "—",
      "font_family_guess": "generic sans",
      "font_family_css": "'Noto Sans KR', 'Malgun Gothic', sans-serif",
      "font_style_notes": "single centered dash",
      "x": 412,
      "y": 118,
      "w": 36,
      "h": 22,
      "font_size": 28,
      "font_weight": 600,
      "line_height": 1.0,
      "letter_spacing": 0,
      "align": "center",
      "color": "#252b33",
      "background_color": "transparent",
      "border_radius": 0,
      "padding_css": "0",
      "estimated_line_count": 1,
      "estimated_char_count": 1,
      "is_optional": false
    },
    {
      "id": "card_1_text",
      "kind": "body",
      "text": "부위별 맞춤 케어\n4종 교체형 헤드",
      "font_family_guess": "Pretendard or similar sans",
      "font_family_css": "'Pretendard', 'Noto Sans KR', 'Malgun Gothic', sans-serif",
      "font_style_notes": "two-line dark centered Korean text below icon card",
      "x": 68,
      "y": 480,
      "w": 220,
      "h": 92,
      "font_size": 26,
      "font_weight": 600,
      "line_height": 1.45,
      "letter_spacing": -1.0,
      "align": "center",
      "color": "#222831",
      "background_color": "transparent",
      "border_radius": 0,
      "padding_css": "0",
      "estimated_line_count": 2,
      "estimated_char_count": 14,
      "is_optional": false
    },
    {
      "id": "card_2_text",
      "kind": "body",
      "text": "컨디션 맞춤\n6단계 강도 조절",
      "x": 322,
      "y": 480,
      "w": 220,
      "h": 92,
      "font_family_guess": "Pretendard or similar sans",
      "font_family_css": "'Pretendard', 'Noto Sans KR', 'Malgun Gothic', sans-serif",
      "font_style_notes": "two-line dark centered Korean text below icon card",
      "font_size": 26,
      "font_weight": 600,
      "line_height": 1.45,
      "letter_spacing": -1.0,
      "align": "center",
      "color": "#222831",
      "background_color": "transparent",
      "border_radius": 0,
      "padding_css": "0",
      "estimated_line_count": 2,
      "estimated_char_count": 14,
      "is_optional": false
    },
    {
      "id": "card_3_text",
      "kind": "body",
      "text": "3,200RPM\n강력한 모터",
      "x": 576,
      "y": 480,
      "w": 220,
      "h": 92,
      "font_family_guess": "Pretendard or similar sans",
      "font_family_css": "'Pretendard', 'Noto Sans KR', 'Malgun Gothic', sans-serif",
      "font_style_notes": "two-line dark centered Korean text below icon card",
      "font_size": 26,
      "font_weight": 600,
      "line_height": 1.45,
      "letter_spacing": -1.0,
      "align": "center",
      "color": "#222831",
      "background_color": "transparent",
      "border_radius": 0,
      "padding_css": "0",
      "estimated_line_count": 2,
      "estimated_char_count": 13,
      "is_optional": false
    }
  ],
  "image_blocks": [
    { "id": "icon_card_1", "kind": "icon", "x": 50, "y": 193, "w": 230, "h": 230, "fit": "contain", "source_hint": "left icon card with four heads", "crop_notes": "entire rounded icon card area", "has_embedded_text": false },
    { "id": "icon_card_2", "kind": "icon", "x": 321, "y": 193, "w": 230, "h": 230, "fit": "contain", "source_hint": "middle icon card", "crop_notes": "entire rounded icon card area", "has_embedded_text": false },
    { "id": "icon_card_3", "kind": "icon", "x": 583, "y": 193, "w": 230, "h": 230, "fit": "contain", "source_hint": "right icon card", "crop_notes": "entire rounded icon card area", "has_embedded_text": false }
  ],
  "shape_blocks": [],
  "inference_notes": [
    "Three equally spaced feature cards form the main structure.",
    "The icon cards already contain their own internal graphics and rounded white containers.",
    "Only the card captions need separate text reconstruction."
  ]
}
