{
  "section_id": "D_031",
  "canvas": { "width": 800, "height": 905 },
  "background": {
    "type": "solid",
    "base_color": "#f5f5f5",
    "gradient_css": "linear-gradient(180deg, #f6f6f6 0%, #f0f0f0 100%)",
    "notes": "light gray-white spec comparison background"
  },
  "text_blocks": [
    {
      "id": "headline_top_1",
      "kind": "headline",
      "text": "국내 유일, 독보적 스펙",
      "font_family_guess": "Pretendard or similar bold sans",
      "font_family_css": "'Pretendard', 'Noto Sans KR', 'Malgun Gothic', sans-serif",
      "font_style_notes": "large black Korean headline",
      "x": 132,
      "y": 104,
      "w": 536,
      "h": 62,
      "font_size": 46,
      "font_weight": 700,
      "line_height": 1.1,
      "letter_spacing": -2.0,
      "align": "center",
      "color": "#101010",
      "background_color": "transparent",
      "border_radius": 0,
      "padding_css": "0",
      "estimated_line_count": 1,
      "estimated_char_count": 12,
      "is_optional": false
    },
    {
      "id": "headline_top_2",
      "kind": "headline",
      "text": "5세대 커브건",
      "font_family_guess": "Pretendard or similar bold sans",
      "font_family_css": "'Pretendard', 'Noto Sans KR', 'Malgun Gothic', sans-serif",
      "font_style_notes": "very large blue Korean headline",
      "x": 202,
      "y": 178,
      "w": 396,
      "h": 84,
      "font_size": 72,
      "font_weight": 800,
      "line_height": 1.0,
      "letter_spacing": -3.0,
      "align": "center",
      "color": "#0f87a8",
      "background_color": "transparent",
      "border_radius": 0,
      "padding_css": "0",
      "estimated_line_count": 1,
      "estimated_char_count": 8,
      "is_optional": false
    },
    {
      "id": "col_1_title",
      "kind": "label",
      "text": "1세대",
      "font_family_guess": "Pretendard or similar sans",
      "font_family_css": "'Pretendard', 'Noto Sans KR', 'Malgun Gothic', sans-serif",
      "font_style_notes": "white small label centered in gray header",
      "x": 20,
      "y": 343,
      "w": 114,
      "h": 54,
      "font_size": 20,
      "font_weight": 600,
      "line_height": 1.0,
      "letter_spacing": -0.8,
      "align": "center",
      "color": "#ffffff",
      "background_color": "#cccccc",
      "border_radius": 0,
      "padding_css": "16px 8px",
      "estimated_line_count": 1,
      "estimated_char_count": 3,
      "is_optional": false
    },
    {
      "id": "col_2_title",
      "kind": "label",
      "text": "2세대",
      "x": 136,
      "y": 343,
      "w": 114,
      "h": 54,
      "font_family_guess": "Pretendard or similar sans",
      "font_family_css": "'Pretendard', 'Noto Sans KR', 'Malgun Gothic', sans-serif",
      "font_style_notes": "white small label centered in gray header",
      "font_size": 20,
      "font_weight": 600,
      "line_height": 1.0,
      "letter_spacing": -0.8,
      "align": "center",
      "color": "#ffffff",
      "background_color": "#cccccc",
      "border_radius": 0,
      "padding_css": "16px 8px",
      "estimated_line_count": 1,
      "estimated_char_count": 3,
      "is_optional": false
    },
    {
      "id": "col_3_title",
      "kind": "label",
      "text": "3세대",
      "x": 252,
      "y": 343,
      "w": 114,
      "h": 54,
      "font_family_guess": "Pretendard or similar sans",
      "font_family_css": "'Pretendard', 'Noto Sans KR', 'Malgun Gothic', sans-serif",
      "font_style_notes": "white small label centered in gray header",
      "font_size": 20,
      "font_weight": 600,
      "line_height": 1.0,
      "letter_spacing": -0.8,
      "align": "center",
      "color": "#ffffff",
      "background_color": "#bdbdbd",
      "border_radius": 0,
      "padding_css": "16px 8px",
      "estimated_line_count": 1,
      "estimated_char_count": 3,
      "is_optional": false
    },
    {
      "id": "col_4_title",
      "kind": "label",
      "text": "4세대\n커브건",
      "x": 368,
      "y": 330,
      "w": 132,
      "h": 86,
      "font_family_guess": "Pretendard or similar sans",
      "font_family_css": "'Pretendard', 'Noto Sans KR', 'Malgun Gothic', sans-serif",
      "font_style_notes": "white small label centered in mint header",
      "font_size": 18,
      "font_weight": 700,
      "line_height": 1.25,
      "letter_spacing": -0.8,
      "align": "center",
      "color": "#ffffff",
      "background_color": "#81c7cb",
      "border_radius": 0,
      "padding_css": "16px 8px",
      "estimated_line_count": 2,
      "estimated_char_count": 6,
      "is_optional": false
    },
    {
      "id": "col_5_title",
      "kind": "label",
      "text": "5세대\n커브건",
      "x": 502,
      "y": 298,
      "w": 190,
      "h": 118,
      "font_family_guess": "Pretendard or similar bold sans",
      "font_family_css": "'Pretendard', 'Noto Sans KR', 'Malgun Gothic', sans-serif",
      "font_style_notes": "white bold label centered in dark blue header",
      "font_size": 22,
      "font_weight": 800,
      "line_height": 1.28,
      "letter_spacing": -1.0,
      "align": "center",
      "color": "#ffffff",
      "background_color": "#0c7c99",
      "border_radius": 0,
      "padding_css": "18px 10px",
      "estimated_line_count": 2,
      "estimated_char_count": 6,
      "is_optional": false
    },
    {
      "id": "badge_new_1",
      "kind": "badge",
      "text": "2026\nNEW",
      "x": 632,
      "y": 352,
      "w": 70,
      "h": 70,
      "font_family_guess": "Pretendard or similar sans",
      "font_family_css": "'Pretendard', 'Noto Sans KR', 'Malgun Gothic', sans-serif",
      "font_style_notes": "small coral text inside white circle",
      "font_size": 16,
      "font_weight": 700,
      "line_height": 1.1,
      "letter_spacing": -0.4,
      "align": "center",
      "color": "#f08e7d",
      "background_color": "#ffffff",
      "border_radius": 35,
      "padding_css": "14px 8px",
      "estimated_line_count": 2,
      "estimated_char_count": 7,
      "is_optional": false
    }
  ],
  "image_blocks": [
    { "id": "col_1_img", "kind": "product", "x": 40, "y": 430, "w": 78, "h": 176, "fit": "contain", "source_hint": "1st gen product", "crop_notes": "small centered product image", "has_embedded_text": false },
    { "id": "col_2_img", "kind": "product", "x": 150, "y": 430, "w": 92, "h": 176, "fit": "contain", "source_hint": "2nd gen product", "crop_notes": "small centered product image", "has_embedded_text": false },
    { "id": "col_3_img", "kind": "product", "x": 274, "y": 430, "w": 78, "h": 176, "fit": "contain", "source_hint": "3rd gen product", "crop_notes": "small centered product image", "has_embedded_text": false },
    { "id": "col_4_img", "kind": "product", "x": 394, "y": 410, "w": 92, "h": 196, "fit": "contain", "source_hint": "4th gen curve gun", "crop_notes": "product image within highlighted 4th gen column", "has_embedded_text": false },
    { "id": "col_5_img", "kind": "product", "x": 556, "y": 410, "w": 122, "h": 188, "fit": "contain", "source_hint": "5th gen curve gun", "crop_notes": "main hero product image within highlighted 5th gen column", "has_embedded_text": false }
  ],
  "shape_blocks": [
    { "id": "col_4_bg", "kind": "card", "x": 368, "y": 330, "w": 132, "h": 530, "fill": "rgba(129,199,203,0.15)", "radius": 0, "border_css": "2px solid #81c7cb", "shadow_css": "none" },
    { "id": "col_5_bg", "kind": "card", "x": 502, "y": 298, "w": 190, "h": 562, "fill": "#ffffff", "radius": 0, "border_css": "3px solid #0c7c99", "shadow_css": "none" }
  ],
  "inference_notes": [
    "This section is a 5-column comparison table with the last two columns visually emphasized.",
    "The large blue second headline is the main attention anchor.",
    "Most bullet text in the columns is currently omitted from this sample spec and should be added in a production pass if full fidelity is required."
  ]
}
