{
  "section_id": "A_004",
  "canvas": {
    "width": 860,
    "height": 1610
  },
  "background": {
    "type": "solid",
    "base_color": "#d8d8d3",
    "gradient_css": "linear-gradient(180deg, #d9d8d3 0%, #d3d2cc 100%)",
    "notes": "light warm gray studio background with subtle bottom darkening"
  },
  "text_blocks": [
    {
      "id": "brand_1",
      "kind": "label",
      "text": "INSIDY",
      "font_family_guess": "Pretendard or similar geometric sans",
      "font_family_css": "'Pretendard', 'Noto Sans KR', 'Malgun Gothic', sans-serif",
      "font_style_notes": "bold geometric sans, clean tracking",
      "x": 670,
      "y": 118,
      "w": 120,
      "h": 28,
      "font_size": 22,
      "font_weight": 700,
      "line_height": 1.0,
      "letter_spacing": -0.6,
      "align": "left",
      "color": "#2e3139",
      "background_color": "transparent",
      "border_radius": 0,
      "padding_css": "0",
      "estimated_line_count": 1,
      "estimated_char_count": 6,
      "is_optional": false
    },
    {
      "id": "headline_en_1",
      "kind": "headline",
      "text": "MINI MASSAGE GUN",
      "font_family_guess": "Pretendard or similar modern sans",
      "font_family_css": "'Pretendard', 'Noto Sans KR', 'Malgun Gothic', sans-serif",
      "font_style_notes": "all caps sans, medium-heavy weight",
      "x": 410,
      "y": 340,
      "w": 334,
      "h": 40,
      "font_size": 30,
      "font_weight": 700,
      "line_height": 1.1,
      "letter_spacing": -0.5,
      "align": "left",
      "color": "#2f323a",
      "background_color": "transparent",
      "border_radius": 0,
      "padding_css": "0",
      "estimated_line_count": 1,
      "estimated_char_count": 17,
      "is_optional": false
    },
    {
      "id": "headline_ko_1",
      "kind": "headline",
      "text": "미니 마사지건",
      "font_family_guess": "Pretendard or similar bold sans",
      "font_family_css": "'Pretendard', 'Noto Sans KR', 'Malgun Gothic', sans-serif",
      "font_style_notes": "large bold Korean sans headline",
      "x": 444,
      "y": 392,
      "w": 320,
      "h": 64,
      "font_size": 56,
      "font_weight": 800,
      "line_height": 1.0,
      "letter_spacing": -2.0,
      "align": "left",
      "color": "#252a34",
      "background_color": "transparent",
      "border_radius": 0,
      "padding_css": "0",
      "estimated_line_count": 1,
      "estimated_char_count": 7,
      "is_optional": false
    },
    {
      "id": "badge_1",
      "kind": "badge",
      "text": "IMG-300",
      "font_family_guess": "Pretendard or similar sans",
      "font_family_css": "'Pretendard', 'Noto Sans KR', 'Malgun Gothic', sans-serif",
      "font_style_notes": "white bold text centered in dark rounded pill",
      "x": 624,
      "y": 470,
      "w": 152,
      "h": 52,
      "font_size": 24,
      "font_weight": 700,
      "line_height": 1.0,
      "letter_spacing": -0.4,
      "align": "center",
      "color": "#ffffff",
      "background_color": "#343846",
      "border_radius": 26,
      "padding_css": "12px 22px",
      "estimated_line_count": 1,
      "estimated_char_count": 7,
      "is_optional": false
    }
  ],
  "image_blocks": [
    {
      "id": "model_product_1",
      "kind": "model",
      "x": 38,
      "y": 454,
      "w": 702,
      "h": 1128,
      "fit": "contain",
      "source_hint": "single studio photo of woman holding massage gun",
      "crop_notes": "preserve full hand and massage head; body extends to lower edge",
      "has_embedded_text": false
    }
  ],
  "shape_blocks": [
    {
      "id": "badge_bg_1",
      "kind": "pill",
      "x": 624,
      "y": 470,
      "w": 152,
      "h": 52,
      "fill": "#343846",
      "radius": 26,
      "border_css": "none",
      "shadow_css": "none"
    }
  ],
  "inference_notes": [
    "Upper-right text cluster is separate from the main photo block.",
    "There is no body copy under the hero image.",
    "Main photo is one integrated visual block without embedded text.",
    "Exact font family is estimated; weight and placement are the critical reconstruction values."
  ]
}
