{
  "section_id": "A_018",
  "canvas": { "width": 860, "height": 1536 },
  "background": {
    "type": "solid",
    "base_color": "#ffffff",
    "gradient_css": "linear-gradient(180deg, #ffffff 0%, #fbfbfb 100%)",
    "notes": "clean white background"
  },
  "text_blocks": [
    {
      "id": "badge_1",
      "kind": "badge",
      "text": "POINT 05",
      "font_family_guess": "Pretendard or similar sans",
      "font_family_css": "'Pretendard', 'Noto Sans KR', 'Malgun Gothic', sans-serif",
      "font_style_notes": "small gray outline pill",
      "x": 350,
      "y": 82,
      "w": 160,
      "h": 46,
      "font_size": 20,
      "font_weight": 600,
      "line_height": 1.0,
      "letter_spacing": -0.4,
      "align": "center",
      "color": "#666d78",
      "background_color": "#ffffff",
      "border_radius": 23,
      "padding_css": "10px 16px",
      "estimated_line_count": 1,
      "estimated_char_count": 8,
      "is_optional": false
    },
    {
      "id": "headline_1",
      "kind": "headline",
      "text": "편안하고 가벼운 무게",
      "x": 140,
      "y": 168,
      "w": 580,
      "h": 68,
      "font_family_guess": "Pretendard or similar bold sans",
      "font_family_css": "'Pretendard', 'Noto Sans KR', 'Malgun Gothic', sans-serif",
      "font_style_notes": "large centered black Korean headline",
      "font_size": 36,
      "font_weight": 700,
      "line_height": 1.1,
      "letter_spacing": -1.6,
      "align": "center",
      "color": "#1f232b",
      "background_color": "transparent",
      "border_radius": 0,
      "padding_css": "0",
      "estimated_line_count": 1,
      "estimated_char_count": 11,
      "is_optional": false
    },
    {
      "id": "headline_2",
      "kind": "headline",
      "text": "초경량 390g",
      "x": 214,
      "y": 246,
      "w": 432,
      "h": 70,
      "font_family_guess": "Pretendard or similar bold sans",
      "font_family_css": "'Pretendard', 'Noto Sans KR', 'Malgun Gothic', sans-serif",
      "font_style_notes": "large centered teal Korean headline",
      "font_size": 54,
      "font_weight": 800,
      "line_height": 1.0,
      "letter_spacing": -2.4,
      "align": "center",
      "color": "#0f6f86",
      "background_color": "transparent",
      "border_radius": 0,
      "padding_css": "0",
      "estimated_line_count": 1,
      "estimated_char_count": 8,
      "is_optional": false
    },
    {
      "id": "body_1",
      "kind": "body",
      "text": "390g 초경량의 부담없는 설계로\n한 손으로도 편하게 사용 가능합니다.",
      "x": 188,
      "y": 362,
      "w": 484,
      "h": 92,
      "font_family_guess": "Pretendard or similar sans",
      "font_family_css": "'Pretendard', 'Noto Sans KR', 'Malgun Gothic', sans-serif",
      "font_style_notes": "two-line centered dark body text",
      "font_size": 24,
      "font_weight": 600,
      "line_height": 1.45,
      "letter_spacing": -0.8,
      "align": "center",
      "color": "#32363f",
      "background_color": "transparent",
      "border_radius": 0,
      "padding_css": "0",
      "estimated_line_count": 2,
      "estimated_char_count": 27,
      "is_optional": false
    },
    {
      "id": "weight_bg_1",
      "kind": "label",
      "text": "390g",
      "x": 192,
      "y": 1174,
      "w": 476,
      "h": 120,
      "font_family_guess": "Pretendard or similar sans",
      "font_family_css": "'Pretendard', 'Noto Sans KR', 'Malgun Gothic', sans-serif",
      "font_style_notes": "very large pale gray numeric background text",
      "font_size": 96,
      "font_weight": 500,
      "line_height": 1.0,
      "letter_spacing": -2.0,
      "align": "center",
      "color": "#d2d2d2",
      "background_color": "transparent",
      "border_radius": 0,
      "padding_css": "0",
      "estimated_line_count": 1,
      "estimated_char_count": 4,
      "is_optional": false
    }
  ],
  "image_blocks": [
    { "id": "product_1", "kind": "product", "x": 150, "y": 540, "w": 560, "h": 530, "fit": "contain", "source_hint": "main massage gun product image", "crop_notes": "preserve full gun and soft shadow", "has_embedded_text": false }
  ],
  "shape_blocks": [
    { "id": "badge_outline_1", "kind": "pill", "x": 350, "y": 82, "w": 160, "h": 46, "fill": "#ffffff", "radius": 23, "border_css": "2px solid #9aa1aa", "shadow_css": "none" }
  ],
  "inference_notes": [
    "This section is centered and minimal, with the product floating above a gauge-like visual.",
    "The large pale 390g at the bottom works as a background label and should remain light.",
    "The semicircle gauge marks are currently not reconstructed in this sample pass."
  ]
}
