{
  "section_id": "C_010",
  "canvas": {
    "width": 480,
    "height": 800
  },
  "background": {
    "type": "solid",
    "base_color": "#f4ebe4",
    "gradient_css": "linear-gradient(180deg, #f6eee8 0%, #f3e8e1 100%)",
    "notes": "light peach-beige flat background"
  },
  "text_blocks": [
    {
      "id": "headline_1",
      "kind": "headline",
      "text": "시중에 판매되는 목어깨 안마기",
      "font_family_guess": "Pretendard or similar sans",
      "font_family_css": "'Pretendard', 'Noto Sans KR', 'Malgun Gothic', sans-serif",
      "font_style_notes": "regular-bold Korean sans headline",
      "x": 48,
      "y": 66,
      "w": 384,
      "h": 42,
      "font_size": 28,
      "font_weight": 500,
      "line_height": 1.2,
      "letter_spacing": -1.0,
      "align": "left",
      "color": "#232323",
      "background_color": "transparent",
      "border_radius": 0,
      "padding_css": "0",
      "estimated_line_count": 1,
      "estimated_char_count": 16,
      "is_optional": false
    },
    {
      "id": "banner_quote_1",
      "kind": "headline",
      "text": "꼬집는 느낌만 너무 강해요!",
      "font_family_guess": "Pretendard or similar bold sans",
      "font_family_css": "'Pretendard', 'Noto Sans KR', 'Malgun Gothic', sans-serif",
      "font_style_notes": "white bold text inside red speech banner with quote marks",
      "x": 50,
      "y": 115,
      "w": 398,
      "h": 52,
      "font_size": 25,
      "font_weight": 800,
      "line_height": 1.0,
      "letter_spacing": -1.0,
      "align": "center",
      "color": "#ffffff",
      "background_color": "#cc1f1a",
      "border_radius": 0,
      "padding_css": "12px 20px",
      "estimated_line_count": 1,
      "estimated_char_count": 16,
      "is_optional": false
    },
    {
      "id": "headline_2",
      "kind": "headline",
      "text": "이런 리뷰 본 적 있으신가요?",
      "font_family_guess": "Pretendard or similar sans",
      "font_family_css": "'Pretendard', 'Noto Sans KR', 'Malgun Gothic', sans-serif",
      "font_style_notes": "medium Korean sans question headline",
      "x": 62,
      "y": 200,
      "w": 356,
      "h": 44,
      "font_size": 27,
      "font_weight": 500,
      "line_height": 1.2,
      "letter_spacing": -1.0,
      "align": "left",
      "color": "#232323",
      "background_color": "transparent",
      "border_radius": 0,
      "padding_css": "0",
      "estimated_line_count": 1,
      "estimated_char_count": 17,
      "is_optional": false
    },
    {
      "id": "bubble_left_1",
      "kind": "body",
      "text": "목 어깨가 엄청 두꺼운 편도 아닌데 제대로 밀착이 안돼서 효과가 없네요",
      "font_family_guess": "Pretendard or similar sans",
      "font_family_css": "'Pretendard', 'Noto Sans KR', 'Malgun Gothic', sans-serif",
      "font_style_notes": "dark Korean sans in rounded white chat bubble, emphasis on second line",
      "x": 32,
      "y": 505,
      "w": 316,
      "h": 90,
      "font_size": 18,
      "font_weight": 500,
      "line_height": 1.38,
      "letter_spacing": -0.7,
      "align": "left",
      "color": "#2a2a2a",
      "background_color": "#ffffff",
      "border_radius": 18,
      "padding_css": "18px 20px",
      "estimated_line_count": 2,
      "estimated_char_count": 31,
      "is_optional": false
    },
    {
      "id": "bubble_right_1",
      "kind": "body",
      "text": "꼬집는 느낌이 너무 강해서 시원하지도 않고 아프기만 해요ㅠㅠ",
      "font_family_guess": "Pretendard or similar sans",
      "font_family_css": "'Pretendard', 'Noto Sans KR', 'Malgun Gothic', sans-serif",
      "font_style_notes": "dark Korean sans in rounded white chat bubble with bold first line",
      "x": 122,
      "y": 620,
      "w": 292,
      "h": 88,
      "font_size": 17,
      "font_weight": 500,
      "line_height": 1.38,
      "letter_spacing": -0.7,
      "align": "center",
      "color": "#2a2a2a",
      "background_color": "#ffffff",
      "border_radius": 18,
      "padding_css": "18px 20px",
      "estimated_line_count": 2,
      "estimated_char_count": 28,
      "is_optional": false
    },
    {
      "id": "ellipsis_1",
      "kind": "caption",
      "text": "·\n·\n·",
      "font_family_guess": "generic serif-like bullet dots",
      "font_family_css": "'Noto Sans KR', 'Malgun Gothic', sans-serif",
      "font_style_notes": "three vertically stacked centered dots",
      "x": 234,
      "y": 742,
      "w": 12,
      "h": 34,
      "font_size": 18,
      "font_weight": 700,
      "line_height": 0.9,
      "letter_spacing": 0,
      "align": "center",
      "color": "#111111",
      "background_color": "transparent",
      "border_radius": 0,
      "padding_css": "0",
      "estimated_line_count": 3,
      "estimated_char_count": 3,
      "is_optional": false
    }
  ],
  "image_blocks": [
    {
      "id": "comparison_photo_1",
      "kind": "diagram",
      "x": 20,
      "y": 270,
      "w": 420,
      "h": 196,
      "fit": "cover",
      "source_hint": "side-by-side comparison image inside red rounded border",
      "crop_notes": "contains two comparison halves; preserve full border and speech pointer relation above",
      "has_embedded_text": false
    },
    {
      "id": "avatar_right_1",
      "kind": "badge",
      "x": 382,
      "y": 500,
      "w": 66,
      "h": 66,
      "fit": "contain",
      "source_hint": "old man avatar icon with small blue dots",
      "crop_notes": "small circular sticker-like graphic",
      "has_embedded_text": false
    },
    {
      "id": "avatar_left_1",
      "kind": "badge",
      "x": 20,
      "y": 615,
      "w": 78,
      "h": 78,
      "fit": "contain",
      "source_hint": "woman avatar icon left of lower bubble",
      "crop_notes": "small circular sticker-like graphic",
      "has_embedded_text": false
    }
  ],
  "shape_blocks": [
    {
      "id": "banner_bg_1",
      "kind": "card",
      "x": 50,
      "y": 115,
      "w": 398,
      "h": 52,
      "fill": "#cc1f1a",
      "radius": 0,
      "border_css": "none",
      "shadow_css": "none"
    },
    {
      "id": "banner_pointer_1",
      "kind": "mask",
      "x": 222,
      "y": 165,
      "w": 18,
      "h": 18,
      "fill": "#cc1f1a",
      "radius": 0,
      "border_css": "none",
      "shadow_css": "none"
    },
    {
      "id": "compare_border_1",
      "kind": "card",
      "x": 20,
      "y": 270,
      "w": 420,
      "h": 196,
      "fill": "transparent",
      "radius": 18,
      "border_css": "4px solid #b11111",
      "shadow_css": "none"
    },
    {
      "id": "bubble_left_bg_1",
      "kind": "card",
      "x": 32,
      "y": 505,
      "w": 316,
      "h": 90,
      "fill": "#ffffff",
      "radius": 18,
      "border_css": "none",
      "shadow_css": "none"
    },
    {
      "id": "bubble_right_bg_1",
      "kind": "card",
      "x": 122,
      "y": 620,
      "w": 292,
      "h": 88,
      "fill": "#ffffff",
      "radius": 18,
      "border_css": "none",
      "shadow_css": "none"
    }
  ],
  "inference_notes": [
    "This section uses stacked problem-framing text before the comparison image.",
    "The red banner includes a small downward pointer and should be treated as a separate shape.",
    "Chat bubbles and avatar stickers are part of the persuasion layout and should be reconstructed separately.",
    "The dotted ellipsis at the bottom is a visible layout element and should not be omitted."
  ]
}
