{
  "section_id": "C_012",
  "canvas": { "width": 1000, "height": 1631 },
  "background": {
    "type": "gradient",
    "base_color": "#e65f61",
    "gradient_css": "linear-gradient(180deg, #ea6c6d 0%, #e95f5f 42%, #df4f4f 100%)",
    "notes": "warm red gradient background"
  },
  "text_blocks": [
    {
      "id": "badge_top_1",
      "kind": "badge",
      "text": "11번의 리뉴얼, 독자적인 기술 개발···",
      "font_family_guess": "Pretendard or similar sans",
      "font_family_css": "'Pretendard', 'Noto Sans KR', 'Malgun Gothic', sans-serif",
      "font_style_notes": "small white text in dark red rounded pill",
      "x": 178,
      "y": 82,
      "w": 568,
      "h": 68,
      "font_size": 26,
      "font_weight": 700,
      "line_height": 1.0,
      "letter_spacing": -0.8,
      "align": "center",
      "color": "#ffffff",
      "background_color": "#a50d0d",
      "border_radius": 18,
      "padding_css": "18px 24px",
      "estimated_line_count": 1,
      "estimated_char_count": 24,
      "is_optional": false
    },
    {
      "id": "headline_top_1",
      "kind": "headline",
      "text": "끊임없는 시도 끝에 이 모든 고민을",
      "font_family_guess": "Pretendard or similar sans",
      "font_family_css": "'Pretendard', 'Noto Sans KR', 'Malgun Gothic', sans-serif",
      "font_style_notes": "large white Korean sans",
      "x": 48,
      "y": 203,
      "w": 896,
      "h": 76,
      "font_size": 42,
      "font_weight": 500,
      "line_height": 1.18,
      "letter_spacing": -1.6,
      "align": "left",
      "color": "#ffffff",
      "background_color": "transparent",
      "border_radius": 0,
      "padding_css": "0",
      "estimated_line_count": 1,
      "estimated_char_count": 20,
      "is_optional": false
    },
    {
      "id": "headline_top_2",
      "kind": "headline",
      "text": "전부 해결했습니다!",
      "font_family_guess": "Pretendard or similar bold sans",
      "font_family_css": "'Pretendard', 'Noto Sans KR', 'Malgun Gothic', sans-serif",
      "font_style_notes": "very large bold white Korean headline",
      "x": 48,
      "y": 272,
      "w": 760,
      "h": 102,
      "font_size": 74,
      "font_weight": 800,
      "line_height": 1.0,
      "letter_spacing": -3.0,
      "align": "left",
      "color": "#ffffff",
      "background_color": "transparent",
      "border_radius": 0,
      "padding_css": "0",
      "estimated_line_count": 1,
      "estimated_char_count": 11,
      "is_optional": false
    },
    {
      "id": "feature_num_1",
      "kind": "label",
      "text": "첫번째",
      "font_family_guess": "Pretendard or similar sans",
      "font_family_css": "'Pretendard', 'Noto Sans KR', 'Malgun Gothic', sans-serif",
      "font_style_notes": "small white label next to vertical line",
      "x": 78,
      "y": 500,
      "w": 120,
      "h": 40,
      "font_size": 22,
      "font_weight": 600,
      "line_height": 1.0,
      "letter_spacing": -0.8,
      "align": "left",
      "color": "#ffffff",
      "background_color": "transparent",
      "border_radius": 0,
      "padding_css": "0",
      "estimated_line_count": 1,
      "estimated_char_count": 3,
      "is_optional": false
    },
    {
      "id": "feature_title_1",
      "kind": "headline",
      "text": "부드러운 360° 회전",
      "font_family_guess": "Pretendard or similar bold sans",
      "font_family_css": "'Pretendard', 'Noto Sans KR', 'Malgun Gothic', sans-serif",
      "font_style_notes": "large bold white feature title",
      "x": 76,
      "y": 540,
      "w": 420,
      "h": 56,
      "font_size": 34,
      "font_weight": 800,
      "line_height": 1.0,
      "letter_spacing": -1.2,
      "align": "left",
      "color": "#ffffff",
      "background_color": "transparent",
      "border_radius": 0,
      "padding_css": "0",
      "estimated_line_count": 1,
      "estimated_char_count": 12,
      "is_optional": false
    },
    {
      "id": "card_left_1",
      "kind": "body",
      "text": "와이라로만 움직임\n마사지 범위가 좁음\n압의 세기가 고르지 않음",
      "font_family_guess": "Pretendard or similar sans",
      "font_family_css": "'Pretendard', 'Noto Sans KR', 'Malgun Gothic', sans-serif",
      "font_style_notes": "centered white body text on gray card header",
      "x": 86,
      "y": 690,
      "w": 368,
      "h": 124,
      "font_size": 18,
      "font_weight": 500,
      "line_height": 1.45,
      "letter_spacing": -0.6,
      "align": "center",
      "color": "#ffffff",
      "background_color": "#666666",
      "border_radius": 0,
      "padding_css": "26px 20px",
      "estimated_line_count": 3,
      "estimated_char_count": 28,
      "is_optional": false
    },
    {
      "id": "card_right_1",
      "kind": "body",
      "text": "자체개발로 부드럽게 360도 회전\n마사지 범위가 넓음\n등의 곡률을 따라 적절한 지압",
      "font_family_guess": "Pretendard or similar bold sans",
      "font_family_css": "'Pretendard', 'Noto Sans KR', 'Malgun Gothic', sans-serif",
      "font_style_notes": "centered white body text on deep red card header",
      "x": 514,
      "y": 690,
      "w": 396,
      "h": 124,
      "font_size": 18,
      "font_weight": 700,
      "line_height": 1.45,
      "letter_spacing": -0.6,
      "align": "center",
      "color": "#ffffff",
      "background_color": "#b41313",
      "border_radius": 0,
      "padding_css": "22px 20px",
      "estimated_line_count": 3,
      "estimated_char_count": 36,
      "is_optional": false
    }
  ],
  "image_blocks": [
    {
      "id": "card_left_photo_1",
      "kind": "diagram",
      "x": 86,
      "y": 814,
      "w": 368,
      "h": 355,
      "fit": "cover",
      "source_hint": "left comparison product photo",
      "crop_notes": "photo below left gray text card",
      "has_embedded_text": false
    },
    {
      "id": "card_right_photo_1",
      "kind": "diagram",
      "x": 514,
      "y": 814,
      "w": 396,
      "h": 355,
      "fit": "cover",
      "source_hint": "right comparison product photo",
      "crop_notes": "photo below right red text card",
      "has_embedded_text": false
    }
  ],
  "shape_blocks": [
    {
      "id": "badge_top_bg_1",
      "kind": "pill",
      "x": 178,
      "y": 82,
      "w": 568,
      "h": 68,
      "fill": "#a50d0d",
      "radius": 18,
      "border_css": "none",
      "shadow_css": "none"
    },
    {
      "id": "feature_line_1",
      "kind": "divider",
      "x": 34,
      "y": 470,
      "w": 4,
      "h": 114,
      "fill": "#ffffff",
      "radius": 2,
      "border_css": "none",
      "shadow_css": "none"
    }
  ],
  "inference_notes": [
    "This section uses strong red comparison framing with top persuasion headline.",
    "The two lower panels are split into text header cards and separate photo blocks.",
    "The left vertical white line is a visible layout cue and should be preserved."
  ]
}
